{
  "$schema": "https://json-schema.org/draft/2020-12/schema",
  "title": "Event",
  "description": "事件账本行：某主体在某时间宣布的 AI 创造侧事件，每行必须带来源",
  "type": "object",
  "required": ["id", "date", "company_or_body", "region", "kind", "source", "confidence", "counted", "status"],
  "properties": {
    "id": { "type": "string", "pattern": "^[a-z0-9][a-z0-9-]+$" },
    "date": { "type": "string", "pattern": "^\\d{4}-\\d{2}-\\d{2}$" },
    "company_or_body": { "type": "string", "minLength": 1 },
    "region": { "type": "string", "pattern": "^([A-Z]{2}|Global)$" },
    "kind": { "enum": ["hiring_commitment", "team_formation", "official_listing", "report_datapoint"] },
    "jobs_count": { "type": ["integer", "null"], "minimum": 1 },
    "jobs_type_zh": { "type": "string" },
    "jobs_type_en": { "type": "string" },
    "occupation_ids": { "type": "array", "items": { "type": "string" } },
    "market_ids": { "type": "array", "items": { "type": "string" } },
    "source": {
      "type": "object",
      "required": ["url", "publisher", "date"],
      "properties": {
        "url": { "type": "string", "pattern": "^https?://" },
        "publisher": { "type": "string", "minLength": 1 },
        "date": { "type": "string", "pattern": "^\\d{4}-\\d{2}(-\\d{2})?$" },
        "quote_zh": { "type": "string" },
        "quote_en": { "type": "string" }
      }
    },
    "confidence": { "enum": ["company_stated", "report_estimated"] },
    "counted": { "type": "boolean", "description": "是否计入 The Number，规则见 docs/methodology.md" },
    "status": { "enum": ["draft", "verified", "published"] },
    "notes_zh": { "type": "string" }
  }
}
